<?xml version="1.0" encoding="UTF-8"?>
<A-1 xmlns:xsi="http://www.w3.org/2001/XMLSchema-instance"
 xsi:noNamespaceSchemaLocation="file:/C:/Users/User/Desktop/a_jedan/a_jedan/src/main/resources/A-1.xsd">
    <autor>
        <ime>
        </ime>
        <prezime>
        </prezime>
        <adresa>
            <grad>
            </grad>
            <naziv_ulice>
            </naziv_ulice>
            <broj_ulice>
            </broj_ulice>
        </adresa>
    </autor>
    <zavod_za_intelektualnu_svoinu>
    </zavod_za_intelektualnu_svoinu>
    <adresa>
        <grad>
        </grad>
        <naziv_ulice>
        </naziv_ulice>
        <broj_ulice>
        </broj_ulice>
    </adresa>
    <obrazac>
    </obrazac>
    <naslov>
    </naslov>
    <podnosilac_firma>
        <poslovno_ime>
        </poslovno_ime>
        <sediste_nosioca_autorskog>
        </sediste_nosioca_autorskog>
    </podnosilac_firma>
    <telefon>
    </telefon>
    <email>
    </email>
    <znak_autora>
    </znak_autora>
    <naslov>
    </naslov>
    <vrsti_autorskog_dela>
    </vrsti_autorskog_dela>
    <forma_zapisa_autorskog_dela>
    </forma_zapisa_autorskog_dela>
    <podnosioci>
        <podnosilac>
            <anoniman>
                <delo_delo_anonimnog_autora>
                </delo_delo_anonimnog_autora>
            </anoniman>
        </podnosilac>
        <podnosilac>
            <ziv>
                <prezime>
                </prezime>
                <ime>
                </ime>
                <adresa>
                    <grad>
                    </grad>
                    <naziv_ulice>
                    </naziv_ulice>
                    <broj_ulice>
                    </broj_ulice>
                </adresa>
                <drzavljanstvo>
                </drzavljanstvo>
            </ziv>
        </podnosilac>
    </podnosioci>
    <da_li_je_delo_stvoreno_u_radnom_odnosu>
    </da_li_je_delo_stvoreno_u_radnom_odnosu>
    <nacin_koriscenja_autorskog_dela>
    </nacin_koriscenja_autorskog_dela>
    <nosilac_prijave>
        <podnosilac_prijave>
        </podnosilac_prijave>
    </nosilac_prijave>
    <podneti_prilozi_zahtev>
        <popunjava>
            <ime>
            </ime>
            <prezime>
            </prezime>
        </popunjava>
        <prilozi_prijave>
        </prilozi_prijave>
        <opis_autorskog_dela>
        </opis_autorskog_dela>
        <primer_autorskog_dela>
        </primer_autorskog_dela>
        <popunjava>
            <ime>
            </ime>
            <prezime>
            </prezime>
        </popunjava>
        <prilozi_prijave>
        </prilozi_prijave>
        <opis_autorskog_dela>
        </opis_autorskog_dela>
        <primer_autorskog_dela>
        </primer_autorskog_dela>
    </podneti_prilozi_zahtev>
    <broj_prijave>
    </broj_prijave>
    <datum_podnosenja>
    </datum_podnosenja>
</A-1>
